,Discussion ID,Author,Body,Likes,Date,Time
0,505819,arsek,"Hi OwenFuller,Did you solve this problem?Because I got the same alarm ""Authentication Failed. Please contact the administrator for further assistance. Error code: 0.""We use GP and google idp.",0,07-11-2022,10:34 AM
1,479183,nekumar,"Cloud Identity Engine (CIE) is available as a (free) core functionality on all hardware (PA-series), virtual (VM-series), cloud (Prisma Access) and management (Panorama) platforms running on PAN‑OS 10.1 and above. Check out ourCloud Identity Engine Solution Brieffor more information.",0,04-19-2022,02:17 PM
2,479183,aricci,"I think is also available with PAN-OS 10.0.X, at least for Prisma access. Do you agree?",0,04-29-2022,04:47 AM
3,452631,Housing1,What did you map here? I am having issues like you,0,03-03-2022,02:21 PM
4,452631,CCIE11129,"Housing1,I'm not doing authentication with Cloud Identity Engine. I'm just trying to get the directory sync part of it working.",0,03-03-2022,03:21 PM
5,452631,CCIE11129,"I was able to get Cloud Identity Engine working on the firewall. I changed the service interface for ""Palo Alto Network Services"" to use the outside interface instead of the default management interface. This didn't work at first until I removed the Cloud Identity Engine config on the firewall and re-added it.With that being said, my new issue is that the CIE group doesn't seem to work for GlobalProtect portal config for agent match criteria. I am able to configure it, but it doesn't seem to work for matching the user even though I see the user and group information on the firewall through CLI which looks correct.",0,03-04-2022,12:57 PM
6,452631,Housing1,Is there an error? maybe in agent log file? I finally got mine working with users and groups in my policies. I haven't tried GlobalProtect yet.,0,03-08-2022,10:34 AM
7,452631,CCIE11129,"Thanks for the reply. The error I see is that the user didn't match a policy in the portal.I have two users in the Azure group that is seen on the firewall via CIE. One user synced from on-prem has the email as the UPN and the other user is a guest in Azure and has a guestuser_email.com#EXT#@xxxxxx.onmicrosoft.com UPN. The users have to log in with email address format to Azure via SAML which works for both users. The on-prem user can map to a portal policy, but guest user cannot. The on-prem user appears in the group with email (same as login), but the guest user shows as UPN which isn't the same as the email login format.Even though the guest user shows as UPN in the group, the email address used for login is an alternative user id and therefore should be able to map the user to the group referenced in the portal policy. I believe that should be the case.",0,03-08-2022,11:01 AM
8,438858,Bryan_Potts,"With TACs help we figured this issue out. I had a comma in my instance name, once I took the comma out that resolved my issue.",2,10-13-2021,11:48 AM
